headline,category
How To Spend More Time With Your Family While Working Remotely,Business
NCAA Football Playoffs Should be Like the NFL,Sports
"Hacker Pleads Guilty To Stealing Over 77,000 Passwords for Netflim",Technology
Lawmakers Want To Boost School Funding To Address Teacher Walkouts,Politics
The Best Sub Sandwiches in the Caribbean You Should Visit This Summer,Travel
The Dark Side Of The Bitcoin Minning,Technology
 Treasury Secretary is Confirmed Today,Politics
The 5 Best Restaurants In The World,Travel
How to Build a Brand for Your Small Business,Business
NY Giannts Quarterback Injured After Being Punched By Teammate,Sports